{
  "$schema": "http://json-schema.org/draft-07/schema#",
  "$id": "https://camunda.github.io/api-test-generator/ns/v1/entity-kinds.schema.json",
  "title": "Entity-kinds ABox (api-test-generator ontology, v1)",
  "description": "TBox JSON Schema for an ABox file describing the entity kinds (the domain nouns) of a single API. Each entry asserts: an entity kind exists; it has one of four shapes (`entity` for in-API-managed with full CRUD, `external-entity` for identifiers minted outside the API, `runtime-entity` for entities emitted by the runtime as a side-effect of other operations, `immutable-entity` for entities created in-API but never updated or deleted and observed only via search); and a list of semantic identifier-type names that identify it. `shape: \"entity\"` kinds carry an all-or-nothing CRUD triple (`establishedBy`/`observableVia`/`revokedBy`) consumed by the EntityLifecycle scenario template (#280) — asymmetric subsets surface as ABox-load validation errors. `shape: \"external-entity\"` kinds (e.g. Client) must NOT carry the CRUD triple. `shape: \"runtime-entity\"` kinds (#305 Phase 4 / Phase 5d, e.g. UserTask, Incident) carry a `fetcher` plus at least one of `mutators[]` (consumed by `UpdatedFieldVisibleOnReadBack`) or `transitions[]` + `stateField` (consumed by `StateTransitionVisibleAfterAction`, #189); `shape: \"immutable-entity\"` kinds (#386, e.g. AgentInstanceIteration) carry only `establishedBy` (client-minted identifier supplied at creation; no observe/revoke/mutate); the if/then/else below enforces that runtime-entity kinds carry the required combination and that entity/external-entity/immutable-entity kinds carry only their permitted fields. The schema is intentionally agnostic to which API ships the kinds — instance-data lives in the per-config ABox file (e.g. configs/camunda-oca/ontology/entity-kinds.json). The optional top-level `@context` and per-entry `@type` are JSON-LD metadata only; no runtime in this repo interprets them, but they are reserved so an external SPARQL/SHACL consumer can ingest the file unchanged. Cross-references against the bundled spec (kind names appearing in operation `produces[]`/`requires[]`, identifier types being live, CRUD op methods being POST/GET/DELETE, etc.) are enforced as L3 invariants in configs/<name>/regression-invariants.test.ts rather than being re-encoded here, because Draft-07 cannot express them.",
  "type": "object",
  "additionalProperties": false,
  "required": [
    "version",
    "kinds"
  ],
  "properties": {
    "$schema": {
      "type": "string"
    },
    "$comment": {
      "description": "Optional free-text note (standard JSON Schema keyword). Ignored by the loader; use it to record why a kind is present or intentionally omitted (e.g. an entity whose CRUD triple is blocked upstream).",
      "type": "string"
    },
    "@context": {
      "description": "Optional JSON-LD context. Ignored by the loader; preserved verbatim so external RDF tooling can resolve term IRIs without modification.",
      "type": [
        "object",
        "string",
        "array"
      ]
    },
    "version": {
      "type": "integer",
      "minimum": 1,
      "description": "Schema version of this ABox file. Bumped only when the TBox shape changes incompatibly."
    },
    "kinds": {
      "type": "array",
      "minItems": 1,
      "items": {
        "$ref": "#/definitions/EntityKind"
      }
    }
  },
  "definitions": {
    "EntityKind": {
      "type": "object",
      "additionalProperties": false,
      "required": [
        "name",
        "shape",
        "identifiers",
        "description"
      ],
      "properties": {
        "@type": {
          "description": "Optional JSON-LD type IRI. Ignored by the loader.",
          "type": "string"
        },
        "name": {
          "type": "string",
          "pattern": "^[A-Z][A-Za-z0-9]+$",
          "description": "PascalCase singular noun naming the entity kind (e.g. `Role`, `Client`)."
        },
        "shape": {
          "type": "string",
          "enum": [
            "entity",
            "external-entity",
            "runtime-entity",
            "immutable-entity"
          ],
          "description": "`entity`: in-API-managed (producer + consumer ops both inside the API). `external-entity`: identifier minted outside the API; planner treats `identifiers[]` as `externalBoundary` (client-mintable, no upstream producer required). `runtime-entity` (#305 Phase 4 / Phase 5d): entity emitted by the runtime as a side-effect of another operation (e.g. UserTask from a process instance, Incident from a failing process instance); discovered via runtimeEmission and re-read via `fetcher`. Carries `mutators[]` (consumed by `UpdatedFieldVisibleOnReadBack`) and/or `transitions[]`+`stateField` (consumed by `StateTransitionVisibleAfterAction`, #189). `immutable-entity` (#386): created in-API (`establishedBy`) but never updated or deleted, and observed only via a search/list op rather than a canonical get-by-id (e.g. AgentInstanceIteration — an append-only conversation-history record identified by a client-minted IterationId). Carries `establishedBy` only; its identifier is supplied by the client at creation (classified as a clientMintedIdentifier via the upstream `x-semantic-establishes` annotation), so no CRUD triple, no mutators/transitions, and no fetcher apply."
        },
        "identifiers": {
          "type": "array",
          "minItems": 1,
          "items": {
            "type": "string",
            "minLength": 1,
            "description": "Semantic identifier-type name (matching the `semanticType` values used in `x-semantic-establishes.identifiedBy` upstream)."
          }
        },
        "establishedBy": {
          "type": "string",
          "minLength": 1,
          "description": "#280 — operationId of the canonical create operation for this entity kind (e.g. `createUser` for `User`). Conventionally a `POST` returning 201. Required on `shape: \"entity\"`; forbidden on `shape: \"external-entity\"` (the all-or-nothing rule is enforced by the if/then/else below)."
        },
        "observableVia": {
          "type": "string",
          "minLength": 1,
          "description": "#280 — operationId of the canonical get-by-id operation for this entity kind (e.g. `getUser` for `User`). Conventionally a `GET` returning 200, accepting the entity's identifier(s) as path parameters. Required on `shape: \"entity\"`; forbidden on `shape: \"external-entity\"`."
        },
        "revokedBy": {
          "type": "string",
          "minLength": 1,
          "description": "#280 — operationId of the canonical delete operation for this entity kind (e.g. `deleteUser` for `User`). Conventionally a `DELETE` returning 204. Required on `shape: \"entity\"`; forbidden on `shape: \"external-entity\"` and `shape: \"runtime-entity\"`. ProcessInstance (cancel/delete divergence) is intentionally excluded here — see follow-up #281."
        },
        "restorableVia": {
          "type": "string",
          "minLength": 1,
          "description": "#426 — operationId of the operation that restores a soft-deleted instance of this entity kind (e.g. `restoreFile` for `File`, `POST /files/{fileKey}/restoration`). When present, the `RestoreLifecycle` template emits a create → observe-present → soft-delete (`revokedBy`) → observe-absent → restore → observe-present scenario, so the restore is exercised against an instance that is actually in the recently-deleted state (a plain requires-chain would invoke restore on a live instance and get 404). OPTIONAL on `shape: \"entity\"` (only kinds whose delete is a soft-delete with a restore op carry it); forbidden on every other shape. Not part of the `entity` all-or-nothing triple — an entity without a restore op simply omits it."
        },
        "mutators": {
          "type": "array",
          "minItems": 1,
          "items": {
            "type": "string",
            "minLength": 1
          },
          "description": "#305 Phase 4 — operationIds of operations that mutate the runtime entity in place (e.g. `updateUserTask`, `assignUserTask`, `completeUserTask` for `UserTask`). Conventionally a `PATCH`/`POST`/`DELETE` on a sub-resource of the entity's identifier (`/{id}/...`). Optional on `shape: \"runtime-entity\"` (the row must carry `mutators[]` or `transitions[]` or both — see the runtime-entity branch of the allOf below); forbidden on `shape: \"entity\"` and `shape: \"external-entity\"`. The `UpdatedFieldVisibleOnReadBack` template emits one scenario per mutator."
        },
        "transitions": {
          "type": "array",
          "minItems": 1,
          "items": {
            "$ref": "#/definitions/StateTransition"
          },
          "description": "#305 Phase 5d / #189 — server-driven state transitions for this runtime entity. Each entry names the operationId of a transition op (e.g. `resolveIncident`), the state the entity is expected to be in *before* the transition is invoked (e.g. `ACTIVE`), and the state it is expected to be in *after* (e.g. `RESOLVED`). Transition ops are distinguished from mutators by carrying no per-field update in the request body — the post-state is implicit in the operation semantics. Consumed by the `StateTransitionVisibleAfterAction` scenario template (one scenario per transition: prereqChain → invoke transition → re-fetch via `fetcher` → assert `<stateField>` equals `to`). Optional on `shape: \"runtime-entity\"` (the row must carry `mutators[]` or `transitions[]` or both); when present, `stateField` is required so the template knows which response leaf to read."
        },
        "stateField": {
          "type": "string",
          "minLength": 1,
          "description": "#305 Phase 5d / #189 — name of the leaf in the `fetcher`'s 200 response that carries this entity's current state (almost always `\"state\"`). Required when `transitions[]` is present (the `StateTransitionVisibleAfterAction` template asserts `body.<stateField> === transition.to`). Forbidden when `transitions[]` is absent (would have no consumer). The L3 invariant verifies the named leaf actually appears in the fetcher's `responseLeafPaths[\"200\"]`."
        },
        "fetcher": {
          "type": "string",
          "minLength": 1,
          "description": "#305 Phase 4 — operationId of the canonical read-back operation for this runtime entity (e.g. `getUserTask` for `UserTask`, `getIncident` for `Incident`). Conventionally a `GET` returning 200, accepting the entity's identifier(s) as path parameters. Required on `shape: \"runtime-entity\"`; forbidden on `shape: \"entity\"` and `shape: \"external-entity\"`."
        },
        "description": {
          "type": "string",
          "minLength": 1
        }
      },
      "allOf": [
        {
          "if": {
            "properties": {
              "shape": {
                "const": "entity"
              }
            }
          },
          "then": {
            "required": [
              "establishedBy",
              "observableVia",
              "revokedBy"
            ],
            "not": {
              "anyOf": [
                {
                  "required": [
                    "mutators"
                  ]
                },
                {
                  "required": [
                    "transitions"
                  ]
                },
                {
                  "required": [
                    "stateField"
                  ]
                },
                {
                  "required": [
                    "fetcher"
                  ]
                }
              ]
            }
          }
        },
        {
          "if": {
            "properties": {
              "shape": {
                "const": "external-entity"
              }
            }
          },
          "then": {
            "not": {
              "anyOf": [
                {
                  "required": [
                    "establishedBy"
                  ]
                },
                {
                  "required": [
                    "observableVia"
                  ]
                },
                {
                  "required": [
                    "revokedBy"
                  ]
                },
                {
                  "required": [
                    "restorableVia"
                  ]
                },
                {
                  "required": [
                    "mutators"
                  ]
                },
                {
                  "required": [
                    "transitions"
                  ]
                },
                {
                  "required": [
                    "stateField"
                  ]
                },
                {
                  "required": [
                    "fetcher"
                  ]
                }
              ]
            }
          }
        },
        {
          "if": {
            "properties": {
              "shape": {
                "const": "runtime-entity"
              }
            }
          },
          "then": {
            "required": [
              "fetcher"
            ],
            "anyOf": [
              {
                "required": [
                  "mutators"
                ]
              },
              {
                "required": [
                  "transitions"
                ]
              }
            ],
            "not": {
              "anyOf": [
                {
                  "required": [
                    "establishedBy"
                  ]
                },
                {
                  "required": [
                    "observableVia"
                  ]
                },
                {
                  "required": [
                    "revokedBy"
                  ]
                },
                {
                  "required": [
                    "restorableVia"
                  ]
                }
              ]
            }
          }
        },
        {
          "if": {
            "properties": {
              "shape": {
                "const": "immutable-entity"
              }
            }
          },
          "then": {
            "required": [
              "establishedBy"
            ],
            "not": {
              "anyOf": [
                {
                  "required": [
                    "observableVia"
                  ]
                },
                {
                  "required": [
                    "revokedBy"
                  ]
                },
                {
                  "required": [
                    "restorableVia"
                  ]
                },
                {
                  "required": [
                    "mutators"
                  ]
                },
                {
                  "required": [
                    "transitions"
                  ]
                },
                {
                  "required": [
                    "stateField"
                  ]
                },
                {
                  "required": [
                    "fetcher"
                  ]
                }
              ]
            }
          }
        },
        {
          "if": {
            "required": [
              "transitions"
            ]
          },
          "then": {
            "required": [
              "stateField"
            ]
          }
        },
        {
          "if": {
            "required": [
              "stateField"
            ]
          },
          "then": {
            "required": [
              "transitions"
            ]
          }
        }
      ]
    },
    "StateTransition": {
      "type": "object",
      "additionalProperties": false,
      "required": [
        "op",
        "from",
        "to"
      ],
      "properties": {
        "op": {
          "type": "string",
          "minLength": 1,
          "description": "OperationId of the transition op (e.g. `resolveIncident`). Conventionally a `POST` on a sub-resource of the entity (`/{id}/resolution`) whose request body carries no new field value — the post-state is implicit in the operation semantics. At instantiation time the planner resolves this to its canonical scenario and uses the final RequestStep as the invoke step."
        },
        "from": {
          "type": "string",
          "minLength": 1,
          "description": "Entity state expected *before* the transition is invoked (e.g. `ACTIVE`). Currently informational — the template trusts the chain to deliver the entity in this state (e.g. `searchIncidents` only ever surfaces ACTIVE incidents on the OCA API). Recorded explicitly so future tightening (an explicit pre-state witness step) is a template change, not an ABox migration."
        },
        "to": {
          "type": "string",
          "minLength": 1,
          "description": "Entity state expected *after* the transition is invoked (e.g. `RESOLVED`). Compiled into the `stateEquals` assertion on the read-back step: `expect(body.<stateField>).toBe(<to>)`."
        }
      }
    }
  }
}
