{
  "$schema": "https://camunda.github.io/api-test-generator/ns/v1/entity-kinds.schema.json",
  "$comment": "The Version entity-kind (createVersion/getVersion/deleteVersion) is defined below. It was previously omitted while blocked by camunda-hub#25801 (createVersion rejecting every v2-creatable file as 'located inside a process application'), closed as a duplicate of #27382 and fixed by PR #27610; createVersion now succeeds via the public API (see configs/camunda-hub/positive-suppress.json's git history for the removed suppress entries). The remaining gap — a dedicated Version EntityLifecycle (establish/observe/revoke) — is now closed by the Version kind below.",
  "@context": "https://camunda.github.io/api-test-generator/ns/v1/context.jsonld",
  "version": 1,
  "kinds": [
    {
      "@type": "EntityKind",
      "name": "Member",
      "shape": "external-entity",
      "identifiers": ["MemberEmail"],
      "description": "A workspace member, identified by a client-supplied email address (MemberEmail, x-semantic-client-minted). Minted outside this API — the member's user account exists in the IdP; the API only references the email to grant/revoke workspace membership. Never created, fetched, or deleted as a standalone entity; participates only in the WorkspaceMemberMembership edge (addMember / searchMembers / removeMember)."
    },
    {
      "@type": "EntityKind",
      "name": "Workspace",
      "shape": "entity",
      "identifiers": ["WorkspaceKey"],
      "establishedBy": "createWorkspace",
      "observableVia": "getWorkspace",
      "revokedBy": "deleteWorkspace",
      "restorableVia": "restoreWorkspace",
      "description": "A workspace entity, identified by its server-minted workspaceKey. Established via createWorkspace (POST /workspaces), observed via getWorkspace, revoked via deleteWorkspace (a soft-delete). restoreWorkspace (POST /workspaces/{workspaceKey}/restoration) restores a soft-deleted workspace — the RestoreLifecycle template (#426) drives create → soft-delete → restore so restore is exercised against a recently-deleted workspace rather than a live one (which 404s)."
    },
    {
      "@type": "EntityKind",
      "name": "Project",
      "shape": "entity",
      "identifiers": ["ProjectKey"],
      "establishedBy": "createProject",
      "observableVia": "getProject",
      "revokedBy": "deleteProject",
      "restorableVia": "restoreProject",
      "description": "A project (process application) entity, identified by its server-minted projectKey. Established via createProject (POST /projects), observed via getProject, revoked via deleteProject (a soft-delete). restoreProject (POST /projects/{projectKey}/restoration) restores a soft-deleted project — the RestoreLifecycle template (#426) drives create → soft-delete → restore so restore is exercised against a recently-deleted project rather than a live one (which 404s)."
    },
    {
      "@type": "EntityKind",
      "name": "File",
      "shape": "entity",
      "identifiers": ["FileKey"],
      "establishedBy": "createFile",
      "observableVia": "getFile",
      "revokedBy": "deleteFile",
      "restorableVia": "restoreFile",
      "description": "A file entity, identified by its server-minted fileKey. Established via createFile (POST /files), observed via getFile, revoked via deleteFile (a soft-delete). restoreFile (POST /files/{fileKey}/restoration) restores a soft-deleted file — the RestoreLifecycle template (#426) drives create → soft-delete → restore so restore is exercised against a recently-deleted file rather than a live one (which 404s)."
    },
    {
      "@type": "EntityKind",
      "name": "Folder",
      "shape": "entity",
      "identifiers": ["FolderKey"],
      "establishedBy": "createFolder",
      "observableVia": "getFolder",
      "revokedBy": "deleteFolder",
      "restorableVia": "restoreFolder",
      "description": "A folder entity, identified by its server-minted folderKey. Established via createFolder (POST /folders), observed via getFolder, revoked via deleteFolder (a soft-delete). restoreFolder (POST /folders/{folderKey}/restoration) restores a soft-deleted folder — the RestoreLifecycle template (#426) drives create → soft-delete → restore so restore is exercised against a recently-deleted folder rather than a live one (which 404s)."
    },
    {
      "@type": "EntityKind",
      "name": "ProjectSnapshot",
      "shape": "entity",
      "identifiers": ["ProjectSnapshotKey"],
      "establishedBy": "createProjectSnapshot",
      "observableVia": "getProjectSnapshot",
      "revokedBy": "deleteProjectSnapshot",
      "description": "A project snapshot entity, identified by its server-minted projectSnapshotKey. Established via createProjectSnapshot (POST /project-snapshots), observed via getProjectSnapshot, revoked via deleteProjectSnapshot — the EntityLifecycle template drives create → observe → revoke. No RestoreLifecycle: the collection has no /project-snapshots/recently-deleted/search, and restoreProjectSnapshot (POST /project-snapshots/{projectSnapshotKey}/restoration) restores project state from a snapshot rather than restoring a soft-deleted snapshot, so it is not a restore of this entity."
    },
    {
      "@type": "EntityKind",
      "name": "Version",
      "shape": "entity",
      "identifiers": ["VersionKey"],
      "establishedBy": "createVersion",
      "observableVia": "getVersion",
      "revokedBy": "deleteVersion",
      "description": "A version entity, identified by its server-minted versionKey. Established via createVersion (POST /versions, which snapshots the current content of a file), observed via getVersion, revoked via deleteVersion — the EntityLifecycle template drives create → observe → revoke. No RestoreLifecycle: deleteVersion is a hard delete, the collection has no /versions/recently-deleted/search, and restoreVersion (POST /versions/{versionKey}/restoration) restores the file content to the state captured in a version rather than restoring a soft-deleted version, so it is not a restore of this entity."
    }
  ]
}
